{
  "schema_version": "1.0.0",
  "brand_id": "brand_test",
  "created_at": "2026-09-08T00:00:00+00:00",
  "updated_at": "2026-09-08T00:00:00+00:00",
  "status": "active",
  "version": 1,
  "identity": {
    "name": "Test Brand",
    "mission": "Test mission",
    "vision": "Test vision",
    "values": ["quality"],
    "value_proposition": "Test value",
    "positioning": "Test positioning"
  },
  "market": {
    "category": "technology",
    "competitors": [],
    "differentiators": [
      "clear educational content"
    ]
  },
  "audience": {
    "target": "Creators",
    "interests": ["AI"],
    "problems": ["complex technology"],
    "desires": ["learn"],
    "knowledge_level": "mixed",
    "geography": [],
    "languages": ["en"]
  },
  "personality": {
    "archetype": "Sage",
    "tone": ["clear"],
    "voice": "professional",
    "attitude": ["helpful"]
  },
  "content": {
    "pillars": ["technology"],
    "formats": ["video"],
    "topics": ["AI"],
    "storytelling": "educational"
  },
  "channels_community": {
    "primary_platforms": ["YouTube"],
    "content_repurposing": "shorts",
    "engagement_strategy": "community"
  },
  "visual": {
    "style": "modern",
    "colors": ["blue"],
    "characters": [],
    "animation": "minimal"
  },
  "rules": {
    "do": ["educate"],
    "dont": ["mislead"],
    "sensitive_topics": []
  },
  "business": {
    "goals": ["growth"],
    "monetization": ["ads"],
    "kpis": ["views"]
  }
}